bucket,n_institutes,annual_grads,annual_placed,placement_pct,median_salary_lakh,share_of_stem_pct,source,notes
1. IITs,23,15647,14333,91.6,17.2,1.13,"JoSAA 2024 seat matrix (17,385 first-year B.Tech seats across 23 IITs) + College DB scorecards (NIRF Mandatory Disclosure PDFs scraped per-institute, incl. IIT Goa which doesn't appear in NIRF aggregate rankings)",All 23 IITs covered. Median salary range across IITs: ₹12 L (IIT Palakkad) to ₹22.5 L (IIT Guwahati). Top-quartile placements at IIT-B/D/M cross ₹50 L/yr (mean is much higher than median).
2. NITs / IIITs,57,29510,26227,88.9,10.1,2.14,"JoSAA 2024 seat matrix (NITs: 24,229 first-year seats / IIITs: 8,560 first-year seats; × 90% completion) + College DB scorecards. 31 of 31 NITs have placement data; 17 of 26 IIITs have placement data — remaining 9 IIITs (newer/PPP) extrapolated using NIT-tier avg.","Sample placement rates: NIT Trichy 95%, NIT Surathkal 92%, NIT Warangal 89%, NIT Goa 86%; IIIT Allahabad 97%, IIIT Hyderabad 96%, IIIT Bangalore 89%. Smallest NITs/IIITs (Manipur, Mizoram, Sikkim, Sri City, Vadodara, Bhopal etc.) have weaker data coverage."
3. Govt MBBS colleges,423,54000,,,15.0,3.91,"NMC seat matrix 2024-25 (sources/nmc_mbbs_seat_matrix_2024-25.pdf): 60,324 govt seats of 118,190 total (51%). Completion rate ~90% assumed.",All MBBS grads functionally 'placed' as junior doctors via internship/PG. Income depends on whether they specialise (most do); MBBS-only general practice in govt sector earns ₹6-8 L; specialist post-PG earns ₹15-25 L.
4. Top-200 NIRF Engineering (non-IIT/NIT/IIIT),137,155398,110021,70.8,7.5,11.24,"NIRF 2025 top-100 (52 non-IIT/NIT/IIIT institutes) + NIRF 2022 ranks 101-200 (85 institutes). Mostly private + state engineering colleges (BITS, VIT, SRM, Thapar, MANIT, COEP, PSG, Anna Univ campuses, …).","NIRF 2023+ stopped individual ranking past 100 (bucketed bands instead), so 101-200 is from 2022 cycle. Composition of 101-200 doesn't change much YoY."
5. IT & Computer (BCA / B.Sc IT),,258203,,,2.8,18.68,"AISHE 2021-22 Table 35 — IT & Computer discipline UG out-turn = 258,203. Distinct from Engineering & Technology (which includes B.Tech CSE).","Mostly BCA + B.Sc IT + B.Sc Computer Apps (NOT B.Tech CSE — that's in Engineering & Technology). AICTE 2024-25 Computer Applications intake = 1,32,606 (UG+PG combined). Income closer to ₹2.5-3.5 L typically since these grads compete for entry-level IT-support roles."
6. All others (long tail),,868600,,,3.0,62.85,Engineering & Technology residual (AISHE 8.30 L − IIT 15.6K − NIT+IIIT 29.5K − NIRF-top-200-other 155K = ~629K) + Medical Science residual (AISHE 2.94 L − Govt MBBS 54K = ~240K),"The vast majority — ~6.3 L engineering grads from non-NIRF colleges + ~2.4 L non-MBBS medical (BDS, AYUSH, B.Pharm, Nursing). PLFS-implied avg salary for this cohort: ₹2.5-3.5 L/year in regular jobs, ~30-40% placement rate at best."
