bucket,n_institutes,annual_grads,annual_placed,employment_rate_pct,rate_source,avg_pay_lakh,pay_metric,pay_source,pct_of_stem_ug,pct_of_all_ug,notes
1. IITs,23,15647,14333,91.6,NIRF placement rate (institution-reported),17.2,median salary (NIRF),College DB scorecards (NIRF Mandatory Disclosure PDFs),1.13,0.2,"All 23 IITs covered (incl. IIT Goa, sourced via direct NIRF PDF scrape since IIT Goa isn't in NIRF aggregate top-100). Median range: ₹12 L (Palakkad) to ₹22.5 L (Guwahati). Top-quartile placements at IIT-B/D/M cross ₹50 L."
2. NITs / IIITs,57,29510,26227,88.9,NIRF placement rate (College DB avg across NITs + IIITs),10.1,median salary (NIRF),College DB scorecards (NIRF Mandatory Disclosure PDFs),2.14,0.38,"31 NITs (all with placement data) + 26 IIITs (17 with placement, 9 newer/PPP extrapolated at NIT-tier avg). Range: NIT Trichy 95% / ₹14 L → NIT Goa 86% / ₹8 L → IIIT Hyderabad ₹22 L → IIIT Allahabad ₹15 L."
3. Govt MBBS colleges,423,54000,54000,100.0,Compulsory internship + NEET-PG funnel — all MBBS grads become doctors,7.0,starting salary (Junior Resident govt scale),Govt 7th Pay Commission pay matrix for Junior Residents (~₹56K/month) + cross-checks with PLFS Medical bucket (₹3.65 L) which under-counts due to pooling with nurses/AYUSH,3.91,0.7,"60,324 govt MBBS seats × 90% completion. ₹7 L is starting JR salary; long-run median rises to ₹15-25 L post-PG specialist (3-5 yrs later). No NIRF placement concept since MBBS doesn't go through campus placement."
4. Top-200 NIRF Engineering (non-IIT/NIT/IIIT),137,155398,110021,70.8,NIRF placement rate (NIRF 2025 top-100 + NIRF 2022 ranks 101-200),7.5,weighted median salary (NIRF top-100 + 101-200 average),NIRF aggregate (BQ external_data_sources),11.25,2.0,"BITS, VIT, SRM, Thapar, MANIT, COEP, PSG, Anna Univ campuses, etc. Top-100 median ₹9.8 L; 101-200 median ₹5.1 L. NIRF 2023+ stopped publishing individual ranks past 100, so 101-200 portion uses NIRF 2022 cycle."
5. All other STEM grads (non-elite engineering + IT/Computer + non-MBBS medical),,1126803,,36.5,"PLFS Annual 2023-24, age 25-30: Graduate-non-technical bucket (BCA/BSc-IT, 28%) + Engineering bucket non-elite back-calc (~35%) + Medical bucket (51%, mixes BDS/AYUSH/Pharma/Nursing).",2.7,PLFS-derived weighted avg salary for regular salaried,PLFS Annual 2023-24 (Graduate-non-tech ₹2.80 L; non-elite engg ~₹2.3 L; non-MBBS medical ₹3.65 L). All within ₹2.3-3.65 L band.,81.57,14.53,"Composition: ~258K BCA/B.Sc-IT (AISHE IT & Computer) + ~629K state/tier-3 engineering + ~240K non-MBBS medical (BDS, AYUSH, B.Pharm, Nursing, BPT, allied health). Earnings + employment rates are statistically indistinguishable across these sub-cohorts in PLFS, so collapsed into one bucket."
