bucket,n_institutes,annual_grads,annual_placed,employment_rate_pct,rate_source,avg_pay_24_29_lakh,avg_pay_30_34_lakh,avg_pay_35_40_lakh,pay_metric,pay_source,pct_of_stem_ug,pct_of_all_ug,notes
1. IITs,23,15647,14333,91.6,NIRF placement rate (institution-reported),17.2,21.8,26.5,median salary at graduation (NIRF); progression via PLFS Engineering ×1.27 / ×1.54,College DB scorecards (NIRF MD PDFs) + PLFS Annual 2023-24 age-band growth,1.13,0.2,"All 23 IITs (incl. IIT Goa, sourced via direct NIRF PDF scrape). Range: ₹12 L (Palakkad) to ₹22.5 L (Guwahati). Top-quartile placements at IIT-B/D/M cross ₹50 L. Progression assumes IIT grads track the PLFS Engineering growth curve; the true IIT progression is likely steeper at the top (FAANG/MBA tracks ~3× by mid-30s) but the median tracks PLFS reasonably."
2. NITs / IIITs,57,29510,26227,88.9,NIRF placement rate (College DB avg across NITs + IIITs),10.1,12.8,15.6,median salary at graduation (NIRF); progression via PLFS Engineering ×1.27 / ×1.54,College DB scorecards (NIRF MD PDFs) + PLFS Annual 2023-24,2.14,0.38,31 NITs + 26 IIITs. Range: NIT Trichy 95% / ₹14 L → NIT Goa 86% / ₹8 L → IIIT Hyderabad ₹22 L → IIIT Allahabad ₹15 L. Progression tracks PLFS Engineering curve.
3. Govt MBBS colleges,423,54000,54000,100.0,Compulsory internship + NEET-PG funnel — all MBBS grads become doctors,7.0,8.5,11.0,starting JR govt scale; progression via PLFS Medical ×1.21 / ×1.57,Govt 7th CPC for JR (₹56K/month start); PLFS Annual 2023-24 Medical bucket for age progression,3.91,0.7,"60,324 govt MBBS seats × 90% completion. PLFS Medical bucket pools MBBS with nurses/AYUSH/Pharma so age progression here UNDER-counts true MBBS trajectory: post-PG specialists 30-34 typically earn ₹15-20 L; 35-40 specialists ₹20-30 L (vs PLFS-mult ₹8.5 L and ₹11.0 L below)."
4. Top-200 NIRF Engineering (non-IIT/NIT/IIIT),137,155398,110021,70.8,NIRF placement rate (NIRF 2025 top-100 + NIRF 2022 ranks 101-200),7.5,9.5,11.6,weighted NIRF median (top-100 + 101-200); progression via PLFS Engineering,NIRF aggregate (BQ) + PLFS Annual 2023-24,11.25,2.0,"BITS, VIT, SRM, Thapar, MANIT, COEP, PSG, Anna Univ campuses, etc. Top-100 median ₹9.8 L; 101-200 ₹5.1 L. Latter portion from NIRF 2022 cycle."
5. All other STEM grads (non-elite engineering + IT/Computer + non-MBBS medical),,1126803,,36.5,"PLFS Annual 2023-24, age 24-29: Graduate-non-tech bucket (BCA/BSc-IT 28%), Engineering non-elite back-calc (~35%), Medical (51%).",2.7,3.4,4.2,PLFS-derived per-age-band weighted avg,PLFS Annual 2023-24 directly (no NIRF multiplier needed — this bucket IS the PLFS cohort),81.57,14.53,"Composition: ~258K BCA/B.Sc-IT (AISHE IT & Computer) + ~629K state/tier-3 engineering + ~240K non-MBBS medical (BDS, AYUSH, B.Pharm, Nursing). Earnings + employment statistically indistinguishable across these sub-cohorts in PLFS."
